{
  "$schema": "http://json-schema.org/draft-07/schema#",
  "type": "array",
  "items": {
    "type": "object",
    "properties": {
      "patient_id": {
        "type": "string"
      },
      "race": {
        "type": ["string", "null"]
      },
      "seeded": {
        "type": "boolean"
      },
      "DX_record": {
        "type": "array",
        "items": {
          "type": "object",
          "properties": {
            "date": {
              "type": "string",
              "format": "date"
            },
            "code": {
              "type": "string"
            }
          },
          "required": ["date", "code"],
          "additionalProperties": false
        }
      }
    },
    "required": ["patient_id", "seeded", "DX_record"],
    "additionalProperties": false
  }
}
